"DESCRIPTION","DURATION IN MS","NAME","PARENT SUITE","START TIME","STATUS","STOP TIME","SUB SUITE","SUITE","TEST CLASS","TEST METHOD"
"A simple smoke test that always passes.","10511","Smoke test for the main page","tests.ui","Thu Feb 19 15:59:41 UTC 2026","failed","Thu Feb 19 15:59:52 UTC 2026","","test_smoke","",""
"Change language test for main page.","30845","Verify language switching (UA <-> EN) in Header","tests.ui","Thu Feb 19 15:59:08 UTC 2026","passed","Thu Feb 19 15:59:39 UTC 2026","","test_change_language","",""
"This test verifies that a user can successfully open eco news page. ","3754","Test Validation: Create Eco News with Valid Data. Open Create Eco News page.","tests.ui.news_pages_tests","Thu Feb 19 15:58:56 UTC 2026","passed","Thu Feb 19 15:59:00 UTC 2026","","test_create_update_eco_news_page","",""
"A test for successful habit creation.","1690","Test for successful habit creation","tests.ui.habit_form_tests","Thu Feb 19 15:58:52 UTC 2026","passed","Thu Feb 19 15:58:53 UTC 2026","","test_successful_habit_creation","",""
"Test like one news page like one news","2965","Test like one news on one news page","tests.ui.news_pages_tests","Thu Feb 19 15:59:02 UTC 2026","failed","Thu Feb 19 15:59:05 UTC 2026","","test_one_news_page_like_one_news","",""
"A test that does nothing and always passes.","0","test_nothing","tests","Thu Feb 19 15:58:37 UTC 2026","passed","Thu Feb 19 15:58:37 UTC 2026","","test_stub","",""
