"DESCRIPTION","DURATION IN MS","NAME","PARENT SUITE","START TIME","STATUS","STOP TIME","SUB SUITE","SUITE","TEST CLASS","TEST METHOD"
"A test that does nothing and always passes.","0","test_nothing","tests","Tue Feb 24 12:04:43 UTC 2026","passed","Tue Feb 24 12:04:43 UTC 2026","","test_stub","",""
"This test verifies that a user can successfully open pages after clicking on buttons in vision cards on the page. ","3182","Test Validation: Click buttons in the vision card after sing in.","tests.ui.about_us_page_tests","Tue Feb 24 12:04:46 UTC 2026","passed","Tue Feb 24 12:04:50 UTC 2026","","test_about_us_page_singin_vision_cards_buttons_check","",""
"This test verifies that a user can successfully open eco news page. ","4347","Test Validation: Create Eco News with Valid Data. Open Create Eco News page.","tests.ui.news_pages_tests","Tue Feb 24 12:05:13 UTC 2026","passed","Tue Feb 24 12:05:17 UTC 2026","","test_create_update_eco_news_page","",""
"Verify user can update name, city and credo on Edit Profile page and changes are saved successfully.","3956","Update basic profile information","tests.ui","Tue Feb 24 12:05:25 UTC 2026","passed","Tue Feb 24 12:05:29 UTC 2026","","test_edit_profile_info","",""
"A simple smoke test that always passes.","11434","Smoke test for the main page","tests.ui","Tue Feb 24 12:05:31 UTC 2026","passed","Tue Feb 24 12:05:42 UTC 2026","","test_smoke","",""
"Test Friend Page search.","13611","Search friend requests by partial username","tests.ui.friend_request_page_tests","Tue Feb 24 12:04:51 UTC 2026","skipped","Tue Feb 24 12:05:05 UTC 2026","","test_friend_requests_search","",""
"A test for successful habit creation.","1588","Test for successful habit creation","tests.ui.habit_form_tests","Tue Feb 24 12:05:09 UTC 2026","passed","Tue Feb 24 12:05:11 UTC 2026","","test_successful_habit_creation","",""
"Test like one news page like one news","2713","Test like one news on one news page","tests.ui.news_pages_tests","Tue Feb 24 12:05:20 UTC 2026","failed","Tue Feb 24 12:05:22 UTC 2026","","test_one_news_page_like_one_news","",""
