"DESCRIPTION","DURATION IN MS","NAME","PARENT SUITE","START TIME","STATUS","STOP TIME","SUB SUITE","SUITE","TEST CLASS","TEST METHOD"
"","0","Validate eco news retrieval by ID with different languages -- @1.11 ","","Thu Mar 26 10:14:08 UTC 2026","skipped","Thu Mar 26 10:14:08 UTC 2026","","","",""
"TC-FR-03: Accept friend request and verify it appears in My Friends after refresh.","11880","TC-FR-03: Accept friend request","tests.ui.friend_request_page_tests","Thu Mar 26 10:18:21 UTC 2026","broken","Thu Mar 26 10:18:33 UTC 2026","","test_fr_accept_friend_request","",""
"","0","API returns eco news list with valid filters -- @1.12 ","","Thu Mar 26 10:14:07 UTC 2026","skipped","Thu Mar 26 10:14:07 UTC 2026","","","",""
"","1","Page not found","","Thu Mar 26 10:14:37 UTC 2026","skipped","Thu Mar 26 10:14:37 UTC 2026","","","",""
"We check possibility add field into to do list of some special habit","11107","Add custom item into to_do_list","tests.ui.my_habit_tests","Thu Mar 26 10:19:46 UTC 2026","passed","Thu Mar 26 10:19:57 UTC 2026","","test_one_event_page_add_custom_item_in_to_do_list","",""
"Validate 200 OK response and eco news JSON schema for find_eco_news_by_page with various filters.","255","Test eco news get request's response returns correct data format","tests.api.news_api_tests","Thu Mar 26 10:13:59 UTC 2026","passed","Thu Mar 26 10:13:59 UTC 2026","","test_find_eco_news_by_page","",""
"Test of dislike of eco new","148","Dislike eco new by id.","tests.api.news_api_tests","Thu Mar 26 10:13:54 UTC 2026","passed","Thu Mar 26 10:13:55 UTC 2026","","test_dislike_eco_new","",""
"","1971","Get recommended eco news by id -- @1.5 ","","Thu Mar 26 10:14:13 UTC 2026","broken","Thu Mar 26 10:14:15 UTC 2026","","","",""
"","1550","Delete eco news from favorites by id -- @1.5 ","","Thu Mar 26 10:13:59 UTC 2026","broken","Thu Mar 26 10:14:00 UTC 2026","","","",""
"This test verifies that a user can successfully create eco new. ","2151","Test Validation: Create Eco News with Valid Data.","tests.ui.news_pages_tests","Thu Mar 26 10:21:06 UTC 2026","broken","Thu Mar 26 10:21:08 UTC 2026","","test_create_eco_news_with_valid_data","",""
"","1","Successfully retrieve social network image","","Thu Mar 26 10:14:38 UTC 2026","skipped","Thu Mar 26 10:14:38 UTC 2026","","","",""
"","0","API returns eco news list with valid filters -- @1.9 ","","Thu Mar 26 10:14:07 UTC 2026","skipped","Thu Mar 26 10:14:07 UTC 2026","","","",""
"","102","Verify 403 Forbidden for ROLE_USER with pref 'COMMENTS' and period 'WEEKLY'","tests.api.user_notification_preference_tests","Thu Mar 26 10:14:28 UTC 2026","passed","Thu Mar 26 10:14:28 UTC 2026","","test_forbidden_user_notif_pref","",""
"Test of dislike of eco new","163","Get summary eco new by id.","tests.api.news_api_tests","Thu Mar 26 10:14:13 UTC 2026","passed","Thu Mar 26 10:14:13 UTC 2026","","test_user_like_oneco_new","",""
"","3068","Attempt to create eco news with invalid data","","Thu Mar 26 10:15:01 UTC 2026","broken","Thu Mar 26 10:15:04 UTC 2026","","","",""
"Test like one news page like one news","106","Test eco news get request's response returns correct data format","tests.api.news_api_tests","Thu Mar 26 10:14:02 UTC 2026","passed","Thu Mar 26 10:14:02 UTC 2026","","test_get_eco_news_by_id","",""
"Validate 200 OK response and eco news JSON schema for find_eco_news_by_page with various filters.","220","Test eco news get request's response returns correct data format","tests.api.news_api_tests","Thu Mar 26 10:14:00 UTC 2026","passed","Thu Mar 26 10:14:00 UTC 2026","","test_find_eco_news_by_page","",""
"Test like one news page like one news","105","Test eco news get request's response returns correct data format","tests.api.news_api_tests","Thu Mar 26 10:14:03 UTC 2026","passed","Thu Mar 26 10:14:03 UTC 2026","","test_get_eco_news_by_id","",""
"Test of deletion from favorites of eco new","134","Deletion from favorites eco new by id.","tests.api.news_api_tests","Thu Mar 26 10:13:53 UTC 2026","passed","Thu Mar 26 10:13:53 UTC 2026","","test_delete_from_favourites_eco_new_by_id","",""
"Test of deletion from favorites of eco new","155","Deletion from favorites eco new by id.","tests.api.news_api_tests","Thu Mar 26 10:13:53 UTC 2026","failed","Thu Mar 26 10:13:54 UTC 2026","","test_delete_from_favourites_eco_new_by_id","",""
"","0","API returns an error when invalid query parameters are used -- @1.5 ","","Thu Mar 26 10:14:07 UTC 2026","skipped","Thu Mar 26 10:14:07 UTC 2026","","","",""
"","1449","Get recommended eco news by id -- @1.4 ","","Thu Mar 26 10:14:12 UTC 2026","broken","Thu Mar 26 10:14:13 UTC 2026","","","",""
"","0","Unexpected status code","","Thu Mar 26 10:14:38 UTC 2026","skipped","Thu Mar 26 10:14:38 UTC 2026","","","",""
"Test like one news page like one news","117","Test eco news get request's response returns correct data format","tests.api.news_api_tests","Thu Mar 26 10:14:02 UTC 2026","passed","Thu Mar 26 10:14:02 UTC 2026","","test_get_eco_news_by_id","",""
"","103","Verify 403 Forbidden for ROLE_USER with pref 'INVITES' and period 'DAILY'","tests.api.user_notification_preference_tests","Thu Mar 26 10:14:27 UTC 2026","passed","Thu Mar 26 10:14:27 UTC 2026","","test_forbidden_user_notif_pref","",""
"","1443","Delete eco news by id with invalid or restricted access -- @1.5 ","","Thu Mar 26 10:13:52 UTC 2026","broken","Thu Mar 26 10:13:53 UTC 2026","","","",""
"Test for validation of like or remove of like for eco new by id","209","Like or unlike new by id.","tests.api.news_api_tests","Thu Mar 26 10:14:10 UTC 2026","passed","Thu Mar 26 10:14:10 UTC 2026","","test_like_remove_like_eco_new_by_id","",""
"","0","Mutual friends count consistency","","Thu Mar 26 10:14:37 UTC 2026","skipped","Thu Mar 26 10:14:37 UTC 2026","","","",""
"Test of addition to favorites of eco new","157","Add to favorites eco new by id.","tests.api.news_api_tests","Thu Mar 26 10:13:49 UTC 2026","passed","Thu Mar 26 10:13:49 UTC 2026","","test_add_to_favourites_eco_new_by_id","",""
"","0","Unexpected status code","","Thu Mar 26 10:14:37 UTC 2026","skipped","Thu Mar 26 10:14:37 UTC 2026","","","",""
"","0","Internal server error","","Thu Mar 26 10:14:37 UTC 2026","skipped","Thu Mar 26 10:14:37 UTC 2026","","","",""
"","1","API returns eco news list with valid filters -- @1.4 ","","Thu Mar 26 10:14:07 UTC 2026","skipped","Thu Mar 26 10:14:07 UTC 2026","","","",""
"","119","Verify 403 Forbidden for ROLE_USER with pref 'SYSTEM' and period 'NEVER'","tests.api.user_notification_preference_tests","Thu Mar 26 10:14:29 UTC 2026","passed","Thu Mar 26 10:14:29 UTC 2026","","test_forbidden_user_notif_pref","",""
"","1","User can send, persist, and cancel a friend request","","Thu Mar 26 10:15:12 UTC 2026","skipped","Thu Mar 26 10:15:12 UTC 2026","","","",""
"","1507","Dislike eco news by id -- @1.5 ","","Thu Mar 26 10:14:06 UTC 2026","broken","Thu Mar 26 10:14:07 UTC 2026","","","",""
"Validate 200 OK response and eco news JSON schema for find_eco_news_by_page with various filters.","638","Test eco news get request's response returns correct data format","tests.api.news_api_tests","Thu Mar 26 10:13:59 UTC 2026","passed","Thu Mar 26 10:14:00 UTC 2026","","test_find_eco_news_by_page","",""
"TC-EN-02: Open Eco News article and verify One News page details are displayed.","597","TC-EN-02: Open Eco News article and verify details","tests.ui.news_pages_tests","Thu Mar 26 10:21:19 UTC 2026","broken","Thu Mar 26 10:21:19 UTC 2026","","test_open_one_news_page","",""
"Test of dislike of eco new","112","Get summary eco new by id.","tests.api.news_api_tests","Thu Mar 26 10:14:13 UTC 2026","passed","Thu Mar 26 10:14:13 UTC 2026","","test_user_like_oneco_new","",""
"Testing of social networks image get request using invalid url","103","test_social_networks_get_image_invalid[https://picsum.photos/500-500-error-Internal Server Error]","tests.api.social_networks","Thu Mar 26 10:14:23 UTC 2026","failed","Thu Mar 26 10:14:23 UTC 2026","","test_social_network_image","",""
"","0","Validate eco news retrieval by ID with different languages -- @1.7 ","","Thu Mar 26 10:14:08 UTC 2026","skipped","Thu Mar 26 10:14:08 UTC 2026","","","",""
"","0","Forbidden access","","Thu Mar 26 10:14:38 UTC 2026","skipped","Thu Mar 26 10:14:38 UTC 2026","","","",""
"","0","Validate eco news retrieval by ID with different languages -- @1.19 ","","Thu Mar 26 10:14:08 UTC 2026","skipped","Thu Mar 26 10:14:08 UTC 2026","","","",""
