"DESCRIPTION","DURATION IN MS","NAME","PARENT SUITE","START TIME","STATUS","STOP TIME","SUB SUITE","SUITE","TEST CLASS","TEST METHOD"
"","1781","Update eco news with invalid data -- @1.2 ","","Thu Mar 26 10:17:09 UTC 2026","broken","Thu Mar 26 10:17:11 UTC 2026","","","",""
"Test of dislike of eco new","274","Dislike eco new by id.","tests.api.news_api_tests","Thu Mar 26 10:15:45 UTC 2026","passed","Thu Mar 26 10:15:45 UTC 2026","","test_dislike_eco_new","",""
"Negative security tests: verify regular user receives 403 on restricted email endpoints.","181","Security: Verify regular user gets 403 when trying to send activation message email","tests.api.email_api_tests","Thu Mar 26 10:15:17 UTC 2026","passed","Thu Mar 26 10:15:18 UTC 2026","","test_email","",""
"We check possibility add field into to do list of some special habit","11020","Add custom item into to_do_list","tests.ui.my_habit_tests","Thu Mar 26 10:22:32 UTC 2026","passed","Thu Mar 26 10:22:43 UTC 2026","","test_one_event_page_add_custom_item_in_to_do_list","",""
"","1","Unsuccessful password update due to validation errors -- @1.2 ","","Thu Mar 26 10:17:11 UTC 2026","skipped","Thu Mar 26 10:17:11 UTC 2026","","","",""
"This test verifies that a user can successfully navigate between tabs on Saved page. ","4346","Test Validation: Saved Abstract navigation.","tests.ui","Thu Mar 26 10:25:18 UTC 2026","passed","Thu Mar 26 10:25:22 UTC 2026","","test_saved_abstract_navigation","",""
"Test habit deletion with incorrect habit assigned id","199","Test habit deletion with incorrect data","tests.api.habit_api_tests","Thu Mar 26 10:15:36 UTC 2026","passed","Thu Mar 26 10:15:36 UTC 2026","","test_habit_deletion","",""
"","10058","test_friend_requests_tab_opens[chrome]","tests.ui","Thu Mar 26 10:24:50 UTC 2026","broken","Thu Mar 26 10:25:00 UTC 2026","","test_friend_requests_page","",""
"Test like one news page like one news","208","Test eco news get request's response returns correct data format","tests.api.news_api_tests","Thu Mar 26 10:15:58 UTC 2026","passed","Thu Mar 26 10:15:59 UTC 2026","","test_get_eco_news_by_id","",""
"","0","Validate eco news retrieval by ID with different languages -- @1.16 ","","Thu Mar 26 10:16:26 UTC 2026","skipped","Thu Mar 26 10:16:26 UTC 2026","","","",""
"Test eco news request expecting error","192","Verify proper responses when use invalid query params","tests.api.news_api_tests","Thu Mar 26 10:15:51 UTC 2026","passed","Thu Mar 26 10:15:51 UTC 2026","","test_find_eco_news_by_page","",""
"Verify user can update privacy settings on Edit Profile page and changes are saved successfully.","14145","Update profile privacy settings","tests.ui.edit_profile_page_tests","Thu Mar 26 10:18:52 UTC 2026","broken","Thu Mar 26 10:19:06 UTC 2026","","test_update_privacy_settings","",""
"","5630","Validation of mandatory ""Title"" field","","Thu Mar 26 10:17:24 UTC 2026","passed","Thu Mar 26 10:17:30 UTC 2026","","","",""
"","184","Verify 403 Forbidden for ROLE_USER with pref 'COMMENTS' and period 'IMMEDIATELY'","tests.api.user_notification_preference_tests","Thu Mar 26 10:16:31 UTC 2026","passed","Thu Mar 26 10:16:31 UTC 2026","","test_forbidden_user_notif_pref","",""
"","211","Verify 403 Forbidden for ROLE_USER with pref 'INVITES' and period 'DAILY'","tests.api.user_notification_preference_tests","Thu Mar 26 10:16:33 UTC 2026","passed","Thu Mar 26 10:16:33 UTC 2026","","test_forbidden_user_notif_pref","",""
"Test for validation of like or remove of like for eco new by id","299","Like or unlike new by id.","tests.api.news_api_tests","Thu Mar 26 10:16:09 UTC 2026","passed","Thu Mar 26 10:16:09 UTC 2026","","test_like_remove_like_eco_new_by_id","",""
"","1","Validate eco news retrieval by ID with different languages -- @1.2 ","","Thu Mar 26 10:16:26 UTC 2026","skipped","Thu Mar 26 10:16:26 UTC 2026","","","",""
"Negative security tests: verify regular user receives 403 on restricted email endpoints.","180","Security: Verify regular user gets 403 when trying to trigger scheduled email notification","tests.api.email_api_tests","Thu Mar 26 10:15:19 UTC 2026","passed","Thu Mar 26 10:15:19 UTC 2026","","test_email","",""
"","2629","Like or unlike eco news by id -- @1.3 ","","Thu Mar 26 10:16:54 UTC 2026","broken","Thu Mar 26 10:16:56 UTC 2026","","","",""
"Test summary get of eco new","258","Get recommended eco new by id.","tests.api.news_api_tests","Thu Mar 26 10:16:06 UTC 2026","passed","Thu Mar 26 10:16:06 UTC 2026","","test_get_recommended_eco_news","",""
"","2276","Delete eco news by id with invalid or restricted access -- @1.5 ","","Thu Mar 26 10:16:03 UTC 2026","broken","Thu Mar 26 10:16:05 UTC 2026","","","",""
"","0","Successfully delete social network","","Thu Mar 26 10:17:11 UTC 2026","skipped","Thu Mar 26 10:17:11 UTC 2026","","","",""
"","1738","Delete eco news by id with invalid or restricted access -- @1.3 ","","Thu Mar 26 10:15:58 UTC 2026","broken","Thu Mar 26 10:16:00 UTC 2026","","","",""
"","0","Image page not found","","Thu Mar 26 10:17:11 UTC 2026","skipped","Thu Mar 26 10:17:11 UTC 2026","","","",""
"","0","Successful authentication with valid credentials","","Thu Mar 26 10:17:11 UTC 2026","skipped","Thu Mar 26 10:17:11 UTC 2026","","","",""
"","7694","Adjusting habit durations with the slider -- @1.2 ","","Thu Mar 26 10:19:46 UTC 2026","passed","Thu Mar 26 10:19:54 UTC 2026","","","",""
"","1","API returns eco news list with valid filters -- @1.10 ","","Thu Mar 26 10:16:26 UTC 2026","skipped","Thu Mar 26 10:16:26 UTC 2026","","","",""
"This test verifies that a user can successfully click on form habit buttons. ","3698","Test Validation: About Us Page Buttons Verification.","tests.ui.about_us_page_tests","Thu Mar 26 10:16:43 UTC 2026","broken","Thu Mar 26 10:16:47 UTC 2026","","test_about_us_page_buttons_verification","",""
"","1","Successfully create eco news with valid data","","Thu Mar 26 10:17:34 UTC 2026","skipped","Thu Mar 26 10:17:34 UTC 2026","","","",""
"","2557","Verify Vision Card buttons after sign-in","","Thu Mar 26 10:17:13 UTC 2026","broken","Thu Mar 26 10:17:15 UTC 2026","","","",""
"","0","Unexpected status code","","Thu Mar 26 10:17:11 UTC 2026","skipped","Thu Mar 26 10:17:11 UTC 2026","","","",""
"","0","Forbidden access","","Thu Mar 26 10:17:11 UTC 2026","skipped","Thu Mar 26 10:17:11 UTC 2026","","","",""
"Test summary get of eco new","245","Get recommended eco new by id.","tests.api.news_api_tests","Thu Mar 26 10:16:05 UTC 2026","passed","Thu Mar 26 10:16:05 UTC 2026","","test_get_recommended_eco_news","",""
"","208","Verify 403 Forbidden for ROLE_USER with pref 'PLACES' and period 'NEVER'","tests.api.user_notification_preference_tests","Thu Mar 26 10:16:36 UTC 2026","passed","Thu Mar 26 10:16:37 UTC 2026","","test_forbidden_user_notif_pref","",""
"Test get habit assignments for current user with supported language codes","494","Test user can retrieve habit assignments with supported language codes","tests.api.habit_api_tests","Thu Mar 26 10:15:26 UTC 2026","passed","Thu Mar 26 10:15:26 UTC 2026","","test_get_all_habit_assignments_for_current_user","",""
"Test for validation of correctness of DELETE request.","218","Delete eco new by id.","tests.api.news_api_tests","Thu Mar 26 10:15:41 UTC 2026","passed","Thu Mar 26 10:15:42 UTC 2026","","test_delete_eco_new_by_id","",""
"","4434","User signs out from the account","","Thu Mar 26 10:18:36 UTC 2026","passed","Thu Mar 26 10:18:41 UTC 2026","","","",""
"Test like one news page like one news","205","Test eco news get request's response returns correct data format","tests.api.news_api_tests","Thu Mar 26 10:15:57 UTC 2026","passed","Thu Mar 26 10:15:57 UTC 2026","","test_get_eco_news_by_id","",""
"","199","Verify 403 Forbidden for ROLE_USER with pref 'SYSTEM' and period 'TWICE_A_DAY'","tests.api.user_notification_preference_tests","Thu Mar 26 10:16:31 UTC 2026","passed","Thu Mar 26 10:16:32 UTC 2026","","test_forbidden_user_notif_pref","",""
"Test like one news page like one news","201","Test eco news get request's response returns correct data format","tests.api.news_api_tests","Thu Mar 26 10:16:02 UTC 2026","passed","Thu Mar 26 10:16:02 UTC 2026","","test_get_eco_news_by_id","",""
"","1","Validate eco news retrieval by ID with different languages -- @1.18 ","","Thu Mar 26 10:16:26 UTC 2026","skipped","Thu Mar 26 10:16:26 UTC 2026","","","",""
"","3054","Add eco news to favorites by id -- @1.3 ","","Thu Mar 26 10:15:45 UTC 2026","broken","Thu Mar 26 10:15:48 UTC 2026","","","",""
"","27416","Add eco news to favorites by id -- @1.1 ","","Thu Mar 26 10:15:14 UTC 2026","broken","Thu Mar 26 10:15:42 UTC 2026","","","",""
"","2284","Get recommended eco news by id -- @1.4 ","","Thu Mar 26 10:16:34 UTC 2026","broken","Thu Mar 26 10:16:36 UTC 2026","","","",""
