"DESCRIPTION","DURATION IN MS","NAME","PARENT SUITE","START TIME","STATUS","STOP TIME","SUB SUITE","SUITE","TEST CLASS","TEST METHOD"
"auth login validation","157","Verify successful login, response time, and token validity","tests.api.own-security-controller_tests","Thu Mar 26 12:16:31 UTC 2026","failed","Thu Mar 26 12:16:31 UTC 2026","","test_login_validation","",""
"Test like one news page like one news","35","Test eco news get request's response returns correct data format","tests.api.news_api_tests","Thu Mar 26 12:16:26 UTC 2026","passed","Thu Mar 26 12:16:26 UTC 2026","","test_get_eco_news_by_id","",""
"Check message on the empty 'All friends' tab on the Friend page","24","Check that the 'This user has no friends' message is shown on the 'All friends' tab on the Friend page for a user without friends","tests.ui.all_friends_page_tests","Thu Mar 26 12:17:54 UTC 2026","passed","Thu Mar 26 12:17:55 UTC 2026","","test_user_without_friends_shows_placeholder_message","",""
"","37","Verify 403 Forbidden for ROLE_USER with pref 'LIKES' and period 'NEVER'","tests.api.user_notification_preference_tests","Thu Mar 26 12:16:42 UTC 2026","passed","Thu Mar 26 12:16:42 UTC 2026","","test_forbidden_user_notif_pref","",""
"Validate 200 OK response and eco news JSON schema for find_eco_news_by_page with various filters.","98","Test eco news get request's response returns correct data format","tests.api.news_api_tests","Thu Mar 26 12:16:23 UTC 2026","passed","Thu Mar 26 12:16:23 UTC 2026","","test_find_eco_news_by_page","",""
"Validate 200 OK response and eco news JSON schema for find_eco_news_by_page with various filters.","41","Test eco news get request's response returns correct data format","tests.api.news_api_tests","Thu Mar 26 12:16:24 UTC 2026","passed","Thu Mar 26 12:16:24 UTC 2026","","test_find_eco_news_by_page","",""
"","49","Verify 403 Forbidden for ROLE_USER with pref 'COMMENTS' and period 'DAILY'","tests.api.user_notification_preference_tests","Thu Mar 26 12:16:41 UTC 2026","passed","Thu Mar 26 12:16:41 UTC 2026","","test_forbidden_user_notif_pref","",""
"Test eco news summary retrieval by id (GET /eco-news/{id}/summary)","58","Get summary eco new by id.","tests.api.news_api_tests","Thu Mar 26 12:16:22 UTC 2026","passed","Thu Mar 26 12:16:22 UTC 2026","","test_eco_new_summary","",""
"","6365","Adjusting habit durations with the slider -- @1.3 ","","Thu Mar 26 12:21:53 UTC 2026","passed","Thu Mar 26 12:21:59 UTC 2026","","","",""
"","2753","Update eco news with valid data -- @1.3 ","","Thu Mar 26 12:17:36 UTC 2026","broken","Thu Mar 26 12:17:39 UTC 2026","","","",""
"Test habit deletion by habit assigned id","198","Test habit deletion with correct habit assigned id","tests.api.habit_api_tests","Thu Mar 26 12:16:14 UTC 2026","passed","Thu Mar 26 12:16:14 UTC 2026","","test_habit_deletion","",""
"","2100","Try to assign a habit without authorization","","Thu Mar 26 12:18:12 UTC 2026","passed","Thu Mar 26 12:18:14 UTC 2026","","","",""
"","0","Validate eco news retrieval by ID with different languages -- @1.7 ","","Thu Mar 26 12:16:58 UTC 2026","skipped","Thu Mar 26 12:16:58 UTC 2026","","","",""
"Negative security tests: verify regular user receives 403 on restricted email endpoints.","157","Security: Verify regular user gets 403 when trying to send deactivation reason email","tests.api.email_api_tests","Thu Mar 26 12:16:04 UTC 2026","passed","Thu Mar 26 12:16:05 UTC 2026","","test_email","",""
"Validate 200 OK response and eco news JSON schema for find_eco_news_by_page with various filters.","38","Test eco news get request's response returns correct data format","tests.api.news_api_tests","Thu Mar 26 12:16:25 UTC 2026","passed","Thu Mar 26 12:16:25 UTC 2026","","test_find_eco_news_by_page","",""
"Verify user can update privacy settings on Edit Profile page and changes are saved successfully.","12217","Update profile privacy settings","tests.ui.edit_profile_page_tests","Thu Mar 26 12:18:31 UTC 2026","broken","Thu Mar 26 12:18:43 UTC 2026","","test_update_privacy_settings","",""
"Check if a user card has username, user city, and [Add friend] button","55","Check that friend card has username, city, and [Add friend] button on the 'All friends' tab on the Friend page for a user with friends","tests.ui.all_friends_page_tests","Thu Mar 26 12:17:25 UTC 2026","passed","Thu Mar 26 12:17:25 UTC 2026","","test_user_card_ui_elements_presence","",""
"","1","Validate eco news retrieval by ID with different languages -- @1.5 ","","Thu Mar 26 12:16:58 UTC 2026","skipped","Thu Mar 26 12:16:58 UTC 2026","","","",""
"","2658","Successfully assign a valid habit -- @1.1 ","","Thu Mar 26 12:17:53 UTC 2026","passed","Thu Mar 26 12:17:55 UTC 2026","","","",""
"Test habit assignment without login","141","Test habit assignment without login and correct id","tests.api.habit_api_tests","Thu Mar 26 12:16:12 UTC 2026","passed","Thu Mar 26 12:16:12 UTC 2026","","test_habit_assignment","",""
"","3748","User opens account dropdown menu","","Thu Mar 26 12:20:15 UTC 2026","passed","Thu Mar 26 12:20:19 UTC 2026","","","",""
"Test eco news request expecting error","35","Verify proper responses when use invalid query params","tests.api.news_api_tests","Thu Mar 26 12:16:23 UTC 2026","passed","Thu Mar 26 12:16:23 UTC 2026","","test_find_eco_news_by_page","",""
"","2885","Delete eco news by id with invalid or restricted access -- @1.5 ","","Thu Mar 26 12:16:31 UTC 2026","broken","Thu Mar 26 12:16:33 UTC 2026","","","",""
"TC-MP-01: Verify Main Page loads correctly.","1658","TC-MP-01: Verify Main Page loads correctly","tests.ui.main_page_tests","Thu Mar 26 12:21:24 UTC 2026","passed","Thu Mar 26 12:21:26 UTC 2026","","test_main_page_loads_correctly","",""
"","1","API returns eco news list with valid filters -- @1.11 ","","Thu Mar 26 12:16:58 UTC 2026","skipped","Thu Mar 26 12:16:58 UTC 2026","","","",""
"Test like one news page like one news","273","Test add event link in my events page","tests.ui.my_space_pages_tests.my_events_page_tests","Thu Mar 26 12:22:09 UTC 2026","broken","Thu Mar 26 12:22:09 UTC 2026","","test_add_event_link_in_my_events_page","",""
"","1","Delete social network by id -- @1.3 ","","Thu Mar 26 12:18:18 UTC 2026","skipped","Thu Mar 26 12:18:18 UTC 2026","","","",""
"Test of dislike of eco new","67","Dislike eco new by id.","tests.api.news_api_tests","Thu Mar 26 12:16:21 UTC 2026","passed","Thu Mar 26 12:16:21 UTC 2026","","test_dislike_eco_new","",""
"Test like one news page like one news","39","Test eco news get request's response returns correct data format","tests.api.news_api_tests","Thu Mar 26 12:16:25 UTC 2026","passed","Thu Mar 26 12:16:25 UTC 2026","","test_get_eco_news_by_id","",""
"","1","Get social network image -- @1.1 ","","Thu Mar 26 12:18:18 UTC 2026","skipped","Thu Mar 26 12:18:18 UTC 2026","","","",""
"Test like one news page like one news","34","Test eco news get request's response returns correct data format","tests.api.news_api_tests","Thu Mar 26 12:16:26 UTC 2026","passed","Thu Mar 26 12:16:26 UTC 2026","","test_get_eco_news_by_id","",""
"Validate 200 OK response and eco news JSON schema for find_eco_news_by_page with various filters.","40","Test eco news get request's response returns correct data format","tests.api.news_api_tests","Thu Mar 26 12:16:24 UTC 2026","passed","Thu Mar 26 12:16:25 UTC 2026","","test_find_eco_news_by_page","",""
"","5374","User navigates to profile page from dropdown","","Thu Mar 26 12:20:19 UTC 2026","passed","Thu Mar 26 12:20:24 UTC 2026","","","",""
"","1","API returns eco news list with valid filters -- @1.4 ","","Thu Mar 26 12:16:58 UTC 2026","skipped","Thu Mar 26 12:16:58 UTC 2026","","","",""
"Test for validation of correctness of DELETE request.","63","Delete eco new by id.","tests.api.news_api_tests","Thu Mar 26 12:16:18 UTC 2026","passed","Thu Mar 26 12:16:18 UTC 2026","","test_delete_eco_new_by_id","",""
"","2022","Dislike eco news by id -- @1.3 ","","Thu Mar 26 12:16:50 UTC 2026","broken","Thu Mar 26 12:16:52 UTC 2026","","","",""
"Test get habit assignments for current user with supported language codes","171","Test user can retrieve habit assignments with supported language codes","tests.api.habit_api_tests","Thu Mar 26 12:16:10 UTC 2026","passed","Thu Mar 26 12:16:10 UTC 2026","","test_get_all_habit_assignments_for_current_user","",""
"","32","Verify 401 Unauthorized on preference search without auth token","tests.api.user_notification_preference_tests","Thu Mar 26 12:16:42 UTC 2026","passed","Thu Mar 26 12:16:42 UTC 2026","","test_unauthorized_notif_pref","",""
"Test like one news page like one news","39","Test eco news get request's response returns correct data format","tests.api.news_api_tests","Thu Mar 26 12:16:25 UTC 2026","passed","Thu Mar 26 12:16:25 UTC 2026","","test_get_eco_news_by_id","",""
"","1","API returns eco news list with valid filters -- @1.12 ","","Thu Mar 26 12:16:58 UTC 2026","skipped","Thu Mar 26 12:16:58 UTC 2026","","","",""
"Test that 'Habit description' textarea is required.","324","Check that user is not able to submit a form on the Create Habit page after leaving the 'Habit description' textarea empty","tests.ui.habit_form_tests","Thu Mar 26 12:21:04 UTC 2026","passed","Thu Mar 26 12:21:04 UTC 2026","","test_required_description","",""
"","0","Verify submit button initial state","","Thu Mar 26 12:19:27 UTC 2026","skipped","Thu Mar 26 12:19:27 UTC 2026","","","",""
"","1","API returns an error when invalid query parameters are used -- @1.1 ","","Thu Mar 26 12:16:58 UTC 2026","skipped","Thu Mar 26 12:16:58 UTC 2026","","","",""
"","2062","Add eco news to favorites by id -- @1.3 ","","Thu Mar 26 12:16:14 UTC 2026","broken","Thu Mar 26 12:16:16 UTC 2026","","","",""
"","6428","Adjusting habit durations with the slider -- @1.2 ","","Thu Mar 26 12:21:46 UTC 2026","passed","Thu Mar 26 12:21:53 UTC 2026","","","",""
"Verify user can update privacy settings on Edit Profile page and changes are saved successfully.","11781","Update profile privacy settings","tests.ui.edit_profile_page_tests","Thu Mar 26 12:18:46 UTC 2026","broken","Thu Mar 26 12:18:58 UTC 2026","","test_update_privacy_settings","",""
"","4241","Redirect to the My Friends page","","Thu Mar 26 12:20:55 UTC 2026","passed","Thu Mar 26 12:20:59 UTC 2026","","","",""
"","1","Check if user liked eco news by id -- @1.4 ","","Thu Mar 26 12:17:44 UTC 2026","skipped","Thu Mar 26 12:17:44 UTC 2026","","","",""
"","3207","Get habit assignments for current user with incorrect language code","","Thu Mar 26 12:17:50 UTC 2026","passed","Thu Mar 26 12:17:53 UTC 2026","","","",""
"","35","Verify 403 Forbidden for ROLE_USER with pref 'INVITES' and period 'IMMEDIATELY'","tests.api.user_notification_preference_tests","Thu Mar 26 12:16:41 UTC 2026","passed","Thu Mar 26 12:16:41 UTC 2026","","test_forbidden_user_notif_pref","",""
"Function to test header navigation.","2487","Header navigation test.","tests.ui.header_navigation_tests","Thu Mar 26 12:21:16 UTC 2026","passed","Thu Mar 26 12:21:19 UTC 2026","","test_header_navigation","",""
"A simple smoke test that always passes.","449","Smoke test for the main page","tests.ui","Thu Mar 26 12:24:05 UTC 2026","broken","Thu Mar 26 12:24:06 UTC 2026","","test_smoke","",""
"","0","Successfully retrieve Google Security configuration","","Thu Mar 26 12:17:44 UTC 2026","skipped","Thu Mar 26 12:17:44 UTC 2026","","","",""
"Test for validation of correctness of DELETE request.","58","Delete eco new by id.","tests.api.news_api_tests","Thu Mar 26 12:16:18 UTC 2026","passed","Thu Mar 26 12:16:18 UTC 2026","","test_delete_eco_new_by_id","",""
"","47","Get random fact of the day and validate schema","tests.api.fact_of_the_day_tests","Thu Mar 26 12:16:10 UTC 2026","passed","Thu Mar 26 12:16:10 UTC 2026","","test_get_fact_of_the_day","",""
"","2474","Delete eco news from favorites by id -- @1.5 ","","Thu Mar 26 12:16:43 UTC 2026","broken","Thu Mar 26 12:16:45 UTC 2026","","","",""
"Verify user can update name, city and credo on Edit Profile page and changes are saved successfully.","12599","Update basic profile information","tests.ui.edit_profile_page_tests","Thu Mar 26 12:18:16 UTC 2026","broken","Thu Mar 26 12:18:29 UTC 2026","","test_edit_profile_info","",""
"Test like one news page like one news","57","Test eco news get request's response returns correct data format","tests.api.news_api_tests","Thu Mar 26 12:16:25 UTC 2026","passed","Thu Mar 26 12:16:25 UTC 2026","","test_get_eco_news_by_id","",""
"","4788","User likes or unlikes a news article from the one news page","","Thu Mar 26 12:19:31 UTC 2026","skipped","Thu Mar 26 12:19:36 UTC 2026","","","",""
"","300","Verify deleted event comment is removed from the active comments list","tests.api.event_comment_tests","Thu Mar 26 12:16:07 UTC 2026","passed","Thu Mar 26 12:16:08 UTC 2026","","test_verify_deleted_comment_is_removed","",""
"Test eco news request expecting error","34","Verify proper responses when use invalid query params","tests.api.news_api_tests","Thu Mar 26 12:16:23 UTC 2026","passed","Thu Mar 26 12:16:23 UTC 2026","","test_find_eco_news_by_page","",""
