"DESCRIPTION","DURATION IN MS","NAME","PARENT SUITE","START TIME","STATUS","STOP TIME","SUB SUITE","SUITE","TEST CLASS","TEST METHOD"
"A simple smoke test that always passes.","12202","Smoke test for the main page","tests.ui","Thu Feb 19 12:04:38 UTC 2026","passed","Thu Feb 19 12:04:50 UTC 2026","","test_smoke","",""
"A test for successful habit creation.","1569","Test for successful habit creation","tests.ui.habit_form_tests","Thu Feb 19 12:04:22 UTC 2026","passed","Thu Feb 19 12:04:23 UTC 2026","","test_successful_habit_creation","",""
"This test verifies that a user can successfully open eco news page. ","4141","Test Validation: Create Eco News with Valid Data. Open Create Eco News page.","tests.ui.news_pages_tests","Thu Feb 19 12:04:26 UTC 2026","passed","Thu Feb 19 12:04:30 UTC 2026","","test_create_update_eco_news_page","",""
"Test like one news page like one news","3988","Test like one news on one news page","tests.ui.news_pages_tests","Thu Feb 19 12:04:33 UTC 2026","passed","Thu Feb 19 12:04:37 UTC 2026","","test_one_news_page_like_one_news","",""
"A test that does nothing and always passes.","0","test_nothing","tests","Thu Feb 19 12:04:10 UTC 2026","passed","Thu Feb 19 12:04:10 UTC 2026","","test_stub","",""
