"DESCRIPTION","DURATION IN MS","NAME","PARENT SUITE","START TIME","STATUS","STOP TIME","SUB SUITE","SUITE","TEST CLASS","TEST METHOD"
"Test summary get of eco new","221","Get recommended eco new by id.","tests.api.news_api_tests","Fri Mar 27 11:21:46 UTC 2026","passed","Fri Mar 27 11:21:46 UTC 2026","","test_get_recommended_eco_news","",""
"Test create eco news request with invalid data","201","Update eco new by applying invalid parameters to the form.","tests.api.news_api_tests","Fri Mar 27 11:21:52 UTC 2026","passed","Fri Mar 27 11:21:53 UTC 2026","","test_update_eco_new_by_id","",""
"This test verifies that a user can successfully create eco new. ","3475","Test Validation: Create Eco News with Valid Data.","tests.ui.news_pages_tests","Fri Mar 27 11:29:12 UTC 2026","broken","Fri Mar 27 11:29:16 UTC 2026","","test_create_eco_news_with_valid_data","",""
"Test like one news page like one news","191","Test eco news get request's response returns correct data format","tests.api.news_api_tests","Fri Mar 27 11:21:42 UTC 2026","passed","Fri Mar 27 11:21:42 UTC 2026","","test_get_eco_news_by_id","",""
"Test of dislike of eco new","198","Dislike eco new by id.","tests.api.news_api_tests","Fri Mar 27 11:21:29 UTC 2026","passed","Fri Mar 27 11:21:29 UTC 2026","","test_dislike_eco_new","",""
"Test for validation of like or remove of like for eco new by id","313","Like or unlike new by id.","tests.api.news_api_tests","Fri Mar 27 11:21:48 UTC 2026","passed","Fri Mar 27 11:21:48 UTC 2026","","test_like_remove_like_eco_new_by_id","",""
"Test of deletion from favorites of eco new","211","Deletion from favorites eco new by id.","tests.api.news_api_tests","Fri Mar 27 11:21:26 UTC 2026","passed","Fri Mar 27 11:21:27 UTC 2026","","test_delete_from_favourites_eco_new_by_id","",""
"Validate 200 OK response and eco news JSON schema for find_eco_news_by_page with various filters.","295","Test eco news get request's response returns correct data format","tests.api.news_api_tests","Fri Mar 27 11:21:36 UTC 2026","passed","Fri Mar 27 11:21:36 UTC 2026","","test_find_eco_news_by_page","",""
"Test for validation of correctness of DELETE request.","204","Delete eco new by id.","tests.api.news_api_tests","Fri Mar 27 11:21:25 UTC 2026","passed","Fri Mar 27 11:21:25 UTC 2026","","test_delete_eco_new_by_id","",""
"","181","Verify 403 Forbidden for ROLE_USER with pref 'INVITES' and period 'DAILY'","tests.api.user_notification_preference_tests","Fri Mar 27 11:22:15 UTC 2026","passed","Fri Mar 27 11:22:16 UTC 2026","","test_forbidden_user_notif_pref","",""
"","2170","Try to delete a habit with invalid or non-existent ID -- @1.2 ","","Fri Mar 27 11:23:06 UTC 2026","passed","Fri Mar 27 11:23:08 UTC 2026","","","",""
"Validate 200 OK response and eco news JSON schema for find_eco_news_by_page with various filters.","760","Test eco news get request's response returns correct data format","tests.api.news_api_tests","Fri Mar 27 11:21:35 UTC 2026","passed","Fri Mar 27 11:21:36 UTC 2026","","test_find_eco_news_by_page","",""
"","8431","Verify user search, friend request sending, persistence, and cancellation","tests.ui.find_friend_page_tests","Fri Mar 27 11:25:37 UTC 2026","passed","Fri Mar 27 11:25:46 UTC 2026","","test_findfriend_verify_user_search","",""
"","1","Page not found","","Fri Mar 27 11:22:41 UTC 2026","skipped","Fri Mar 27 11:22:41 UTC 2026","","","",""
"","182","Verify 403 Forbidden for ROLE_USER with pref 'SYSTEM' and period 'MONTHLY'","tests.api.user_notification_preference_tests","Fri Mar 27 11:22:17 UTC 2026","passed","Fri Mar 27 11:22:17 UTC 2026","","test_forbidden_user_notif_pref","",""
"","1","API returns an error when invalid query parameters are used -- @1.3 ","","Fri Mar 27 11:21:57 UTC 2026","skipped","Fri Mar 27 11:21:57 UTC 2026","","","",""
"Test like one news page like one news","185","Test eco news get request's response returns correct data format","tests.api.news_api_tests","Fri Mar 27 11:21:40 UTC 2026","passed","Fri Mar 27 11:21:40 UTC 2026","","test_get_eco_news_by_id","",""
"Test that calendar highlights current system date.","64","Check that calendar highlights current system date on My Space page","tests.ui.my_space_pages_tests.my_space_profile_tests","Fri Mar 27 11:28:32 UTC 2026","passed","Fri Mar 27 11:28:32 UTC 2026","","test_calendar_current_day","",""
"","16953","Viewing friend card in the target user friends list","","Fri Mar 27 11:23:55 UTC 2026","failed","Fri Mar 27 11:24:12 UTC 2026","","","",""
"Test eco news request expecting error","181","Verify proper responses when use invalid query params","tests.api.news_api_tests","Fri Mar 27 11:21:34 UTC 2026","passed","Fri Mar 27 11:21:34 UTC 2026","","test_find_eco_news_by_page","",""
"Test of deletion from favorites of eco new","204","Deletion from favorites eco new by id.","tests.api.news_api_tests","Fri Mar 27 11:21:27 UTC 2026","failed","Fri Mar 27 11:21:28 UTC 2026","","test_delete_from_favourites_eco_new_by_id","",""
"","0","Internal server error","","Fri Mar 27 11:23:15 UTC 2026","skipped","Fri Mar 27 11:23:15 UTC 2026","","","",""
"Test like one news page like one news","184","Test eco news get request's response returns correct data format","tests.api.news_api_tests","Fri Mar 27 11:21:39 UTC 2026","passed","Fri Mar 27 11:21:39 UTC 2026","","test_get_eco_news_by_id","",""
"Test for deletion of social_network by id verification","184","Check user access to the deletion of social media.","tests.api.social_networks","Fri Mar 27 11:22:03 UTC 2026","failed","Fri Mar 27 11:22:04 UTC 2026","","test_delete_social_network","",""
"Test for validation of correctness of DELETE request.","640","Delete eco new by id.","tests.api.news_api_tests","Fri Mar 27 11:21:21 UTC 2026","passed","Fri Mar 27 11:21:22 UTC 2026","","test_delete_eco_new_by_id","",""
"","186","Verify 403 Forbidden for ROLE_USER with pref 'INVITES' and period 'NEVER'","tests.api.user_notification_preference_tests","Fri Mar 27 11:22:18 UTC 2026","passed","Fri Mar 27 11:22:18 UTC 2026","","test_forbidden_user_notif_pref","",""
"","0","User has no permission to check like status","","Fri Mar 27 11:22:41 UTC 2026","skipped","Fri Mar 27 11:22:41 UTC 2026","","","",""
"","0","Display validation errors for empty mandatory fields","","Fri Mar 27 11:25:44 UTC 2026","skipped","Fri Mar 27 11:25:44 UTC 2026","","","",""
"Testing of social networks image get request using invalid url","181","test_social_networks_get_image_invalid[https://picsum.photos/403-403-error-Forbidden]","tests.api.social_networks","Fri Mar 27 11:22:07 UTC 2026","passed","Fri Mar 27 11:22:08 UTC 2026","","test_social_network_image","",""
"","3041","Delete eco news by id with invalid or restricted access -- @1.4 ","","Fri Mar 27 11:21:25 UTC 2026","broken","Fri Mar 27 11:21:28 UTC 2026","","","",""
"","1","API returns eco news list with valid filters -- @1.11 ","","Fri Mar 27 11:21:57 UTC 2026","skipped","Fri Mar 27 11:21:57 UTC 2026","","","",""
"Test of deletion from favorites of eco new","197","Deletion from favorites eco new by id.","tests.api.news_api_tests","Fri Mar 27 11:21:25 UTC 2026","passed","Fri Mar 27 11:21:26 UTC 2026","","test_delete_from_favourites_eco_new_by_id","",""
"Test like one news page like one news","181","Test eco news get request's response returns correct data format","tests.api.news_api_tests","Fri Mar 27 11:21:38 UTC 2026","passed","Fri Mar 27 11:21:38 UTC 2026","","test_get_eco_news_by_id","",""
"Negative security tests: verify regular user receives 403 on restricted email endpoints.","590","Security: Verify regular user gets 403 when trying to send Telegram feedback email","tests.api.email_api_tests","Fri Mar 27 11:20:55 UTC 2026","passed","Fri Mar 27 11:20:55 UTC 2026","","test_email","",""
"Verify user can update privacy settings on Edit Profile page and changes are saved successfully.","12635","Update profile privacy settings","tests.ui.edit_profile_page_tests","Fri Mar 27 11:24:35 UTC 2026","broken","Fri Mar 27 11:24:48 UTC 2026","","test_update_privacy_settings","",""
"Validate 200 OK response and eco news JSON schema for find_eco_news_by_page with various filters.","187","Test eco news get request's response returns correct data format","tests.api.news_api_tests","Fri Mar 27 11:21:36 UTC 2026","passed","Fri Mar 27 11:21:36 UTC 2026","","test_find_eco_news_by_page","",""
"Negative security tests: verify regular user receives 403 on restricted email endpoints.","185","Security: Verify regular user gets 403 when trying to send place status change email","tests.api.email_api_tests","Fri Mar 27 11:20:58 UTC 2026","passed","Fri Mar 27 11:20:58 UTC 2026","","test_email","",""
"Test like one news page like one news","181","Test eco news get request's response returns correct data format","tests.api.news_api_tests","Fri Mar 27 11:21:43 UTC 2026","passed","Fri Mar 27 11:21:43 UTC 2026","","test_get_eco_news_by_id","",""
"Check if a user card has username, user city, and [Add friend] button","64","Check that friend card has username, city, and [Add friend] button on the 'All friends' tab on the Friend page for a user with friends","tests.ui.all_friends_page_tests","Fri Mar 27 11:23:07 UTC 2026","passed","Fri Mar 27 11:23:07 UTC 2026","","test_user_card_ui_elements_presence","",""
"","3591","Dislike eco news by id -- @1.1 ","","Fri Mar 27 11:21:41 UTC 2026","broken","Fri Mar 27 11:21:45 UTC 2026","","","",""
"","1605","Get recommended eco news by id -- @1.3 ","","Fri Mar 27 11:22:01 UTC 2026","broken","Fri Mar 27 11:22:02 UTC 2026","","","",""
"","1572","Verify Vision Card buttons without sign-in","","Fri Mar 27 11:23:20 UTC 2026","broken","Fri Mar 27 11:23:22 UTC 2026","","","",""
"","0","Unsuccessful password update due to validation errors -- @1.3 ","","Fri Mar 27 11:23:15 UTC 2026","skipped","Fri Mar 27 11:23:15 UTC 2026","","","",""
"","211","Get random fact of the day by tags and validate schema","tests.api.fact_of_the_day_tests","Fri Mar 27 11:21:05 UTC 2026","passed","Fri Mar 27 11:21:05 UTC 2026","","test_get_fact_by_tags","",""
"","0","Internal server error","","Fri Mar 27 11:22:41 UTC 2026","skipped","Fri Mar 27 11:22:41 UTC 2026","","","",""
"","0","Forbidden access","","Fri Mar 27 11:23:15 UTC 2026","skipped","Fri Mar 27 11:23:15 UTC 2026","","","",""
"","5896","Validation of mandatory ""Title"" field","","Fri Mar 27 11:24:19 UTC 2026","passed","Fri Mar 27 11:24:25 UTC 2026","","","",""
"Testing of social networks image get request using invalid url","180","test_social_networks_get_image_invalid[https://picsum.photos/400-400-message-Current user has no permission for this action]","tests.api.social_networks","Fri Mar 27 11:22:06 UTC 2026","failed","Fri Mar 27 11:22:07 UTC 2026","","test_social_network_image","",""
"","1","Verify Create Eco News page header","","Fri Mar 27 11:24:31 UTC 2026","skipped","Fri Mar 27 11:24:31 UTC 2026","","","",""
"","3667","Add eco news to favorites by id -- @1.5 ","","Fri Mar 27 11:21:14 UTC 2026","broken","Fri Mar 27 11:21:18 UTC 2026","","","",""
"","0","Validate eco news retrieval by ID with different languages -- @1.10 ","","Fri Mar 27 11:21:57 UTC 2026","skipped","Fri Mar 27 11:21:57 UTC 2026","","","",""
"","5523","Redirect to the Edit Profile page","","Fri Mar 27 11:26:11 UTC 2026","passed","Fri Mar 27 11:26:17 UTC 2026","","","",""
"","622","Verify user can successfully update their own event comment","tests.api.event_comment_tests","Fri Mar 27 11:21:03 UTC 2026","skipped","Fri Mar 27 11:21:04 UTC 2026","","test_verify_user_can_update_comment","",""
"","5248","User switches website language -- @1.2 ","","Fri Mar 27 11:24:48 UTC 2026","passed","Fri Mar 27 11:24:53 UTC 2026","","","",""
"Validate 200 OK response and eco news JSON schema for find_eco_news_by_page with various filters.","274","Test eco news get request's response returns correct data format","tests.api.news_api_tests","Fri Mar 27 11:21:36 UTC 2026","passed","Fri Mar 27 11:21:37 UTC 2026","","test_find_eco_news_by_page","",""
"TC-MP-01: Verify Main Page loads correctly.","3460","TC-MP-01: Verify Main Page loads correctly","tests.ui.main_page_tests","Fri Mar 27 11:27:32 UTC 2026","passed","Fri Mar 27 11:27:35 UTC 2026","","test_main_page_loads_correctly","",""
"Test that authorized user without proper role gets 403","188","Verify getting social network images is forbidden for user","tests.api.management-social-network-images-controller_tests","Fri Mar 27 11:21:17 UTC 2026","passed","Fri Mar 27 11:21:17 UTC 2026","","test_get_all_social_network_images_forbidden","",""
"Test of dislike of eco new","192","Get summary eco new by id.","tests.api.news_api_tests","Fri Mar 27 11:21:53 UTC 2026","passed","Fri Mar 27 11:21:54 UTC 2026","","test_user_like_oneco_new","",""
"","5149","Redirect to the My Friends page","","Fri Mar 27 11:26:17 UTC 2026","passed","Fri Mar 27 11:26:22 UTC 2026","","","",""
"Test correct navigation to Find Friend page.","216","Check that user is redirected to Friends page","tests.ui.my_space_pages_tests.my_space_profile_tests","Fri Mar 27 11:28:48 UTC 2026","passed","Fri Mar 27 11:28:48 UTC 2026","","test_navigation_to_my_friends_page","",""
"","0","Successfully delete social network","","Fri Mar 27 11:23:15 UTC 2026","skipped","Fri Mar 27 11:23:15 UTC 2026","","","",""
"Test correct navigation to Find Friend page.","37","Check that user is redirected to Friends page","tests.ui.my_space_pages_tests.my_space_profile_tests","Fri Mar 27 11:28:42 UTC 2026","skipped","Fri Mar 27 11:28:43 UTC 2026","","test_navigation_to_find_friends_page","",""
"","186","Verify 403 Forbidden for ROLE_USER with pref 'LIKES' and period 'DAILY'","tests.api.user_notification_preference_tests","Fri Mar 27 11:22:15 UTC 2026","passed","Fri Mar 27 11:22:15 UTC 2026","","test_forbidden_user_notif_pref","",""
"Test of dislike of eco new","191","Get summary eco new by id.","tests.api.news_api_tests","Fri Mar 27 11:21:53 UTC 2026","passed","Fri Mar 27 11:21:53 UTC 2026","","test_user_like_oneco_new","",""
